titre_avis;texte_avis;note_avis;date_avis;type_voyage;nb_mots;nb_phrases;vader_compound;vader_sentiment;textblob_polarity;textblob_subjectivity;textblob_sentiment;transformer_label;transformer_score
Plaisir de Noël;Grand bus nolisé, nous serons chauffés en hiver. Entretien nécessaire mais toujours confortable. La salle de bain était propre et sentait bon. N'avait pas de papier toilette ni de désinfectant pour les mains / lavabo / savon.L'hôte était sympathique et hospitalier.;5;3 décembre 2022;;40;1;0.4588;Positif;0.5;1.0;Positif;LABEL_1;0.9979750514030457
Visite des hauteurs de Dyker;Notre visite à Dyker Heights était hors de ce monde, le guide Steve était très instructif et serviable et a donné de nombreux conseils et astuces sur la ville. Nous avons tellement appris au cours de notre voyage que nous ne savions pas déjà et les lumières et les rues étaient incroyables;5;3 décembre 2022;déc. 2022 • En couple;52;1;0.0;Neutre;0.0;0.0;Neutre;LABEL_1;0.9995383024215698
Avis sur Dyker Heights;Alan notre guide était le meilleur! ! ! Tellement bien informés sur New York, nous avons tellement appris! Les lumières étaient belles, mais sa connaissance des maisons l'a rendue encore meilleure ! ! !;5;3 décembre 2022;;29;1;0.0;Neutre;0.13636363636363635;0.45454545454545453;Positif;LABEL_1;0.9996277093887329
Revue Dykers;Enoriqo notre guide a été très instructif et a ajouté de la profondeur à la visite. personnel sympathique et une super expérience dans l'ensemble;5;22 décembre 2021;;24;1;0.5994;Positif;0.3333333333333333;0.6666666666666666;Positif;LABEL_1;0.9996752738952637
Grande tournée!;Antonia était géniale! Je suis un New-Yorkais, mais il a partagé des faits sur la ville que je ne connaissais pas. C'était aussi agréable d'entendre un peu d'histoire du quartier. Il nous a emmenés dans les meilleures maisons et s'est assuré que nous avions le temps de prendre des photos. Je recommanderais certainement cette expérience.;5;16 décembre 2021;;56;1;0.0;Neutre;0.13636363636363635;0.45454545454545453;Positif;LABEL_1;0.999643087387085
La meilleure expérience que nous ayons eue lors d'une tournée de Noël à Dyker Heights.;Nous avons participé à d'autres tournées aux lumières de Noël de Dyker Street. Celui-ci a été de loin la MEILLEURE expérience et je le recommande. Nous avons fait 3 arrêts différents. Le guide et le chauffeur de bus étaient drôles et informatifs. Ils se sont assurés que notre sécurité venait d'une rue. Le bus était propre et amusant. Je choisirai à nouveau cette visite lors de ma prochaine visite. J'ai adoré !;5;8 décembre 2021;déc. 2021 • En famille;72;1;0.0;Neutre;0.0;0.0;Neutre;LABEL_1;0.9996492862701416
Dyker hauteurs lumières de Noël;Dans l'ensemble, un voyage agréable, le guide touristique Milly était super et très compétentLes maisons étaient incroyables et le voyage en autocar était agréable en s'arrêtant à Dumbo sur le chemin du retour pour prendre de superbes photos de la ville et du pont de Brooklyn.;4;7 décembre 2021;;46;1;0.5994;Positif;0.3333333333333333;0.6666666666666666;Positif;LABEL_1;0.9996687173843384
Protocoles COVID non suivis;J'ai noté ce mauvais en raison du non-respect des protocoles COVID. Avec eux perdant l'année dernière en raison de COVID, du récent pic de réclamations COVID et de la nouvelle variante Omicron, je pense qu'ils auraient été trop prudents pour protéger leurs invités. Personne n'a fait vérifier son statut vaccinal. Partout ailleurs, nous sommes allés vérifier le statut vaccinal. Ils n'avaient pas besoin de masques dans le bus. Le bus était extrêmement chaud et un invité est parti avant le début du voyage à cause de la chaleur. Ils ont également joué la musique de Noël trop fort, mais c'était une bonne idée.Dyker Heights était très intéressant à visiter et il y avait de nombreuses expositions élaborées. Je ne referais cela qu'en utilisant une option de transport privé.L'arrêt de charcuterie avait un excellent chocolat chaud et des pizzas.;2;5 décembre 2021;déc. 2021;141;1;0.7783;Positif;1.0;1.0;Positif;LABEL_1;0.8805673122406006
Ennuyeux et long!;Permettez-moi de commencer par dire que j'habite au Texas où il y a beaucoup de maisons et peu d'appartements. Nous avons des lumières de Noël à gogo et j'ai grandi en les voyant. D'après les critiques de cette tournée, je m'attendais à quelque chose de magique mais non. Voyage de 5 heures pour seulement quelques maisons avec des lumières. Rencontré à 17 h. Dépose après 22 h. Notre guide était sympa mais cela ne compensait pas 5 heures de temps perdu.;2;6 décembre 2019;;82;1;-0.4588;Négatif;0.0;0.0;Neutre;LABEL_1;0.679776132106781
Ne gaspillez pas votre argent;Notre guide a raté la sortie et nous avons été retardés de 30 minutes à cause de cela. Les lumières de Dryker sont agréables mais le temps qu'il a fallu ne valait tout simplement pas la peine de voir 10 belles maisons. Il y avait des centaines d'autres personnes dans la rue, les bus ont du mal à naviguer dans ces petites rues, et ce n'était tout simplement pas agréable.;2;6 décembre 2019;déc. 2019 • Entre amis;70;1;-0.25;Négatif;0.0;0.0;Neutre;LABEL_0;0.7656347155570984
Vacances;J'ai adoré les maisons, notre guide était instructif. Trop long de trajet en bus, nous aurions pu sauter sous le pont de Brooklyn. Quelle que soit la beauté de l'horizon, la balade était bien trop longue.;3;6 décembre 2019;déc. 2019 • En couple;36;1;-0.2732;Négatif;-0.05;0.4;Négatif;LABEL_1;0.9996315240859985
Vaut bien une visite;Ces lumières sont hors de ce monde, le coût et les efforts de ces personnes sont incroyables. Si vous aimez Noël et que vous êtes à New York à cette période de l'année, vous en aurez pour votre argent.;5;21 octobre 2019;déc. 2018;39;1;0.0;Neutre;0.13636363636363635;0.45454545454545453;Positif;LABEL_1;0.9989527463912964
Entrez dans l'esprit de Noël!;Les plus belles décorations pour une région, qui apporte les vacances. Facile à apprécier en un ou deux soirs. Vaut levoyage si vous êtes près de la ville pour les vacances!;5;29 septembre 2019;déc. 2018;31;1;0.0;Neutre;0.0;0.0;Neutre;LABEL_1;0.9994146823883057
Educational, entertaining, and lots of walking, but really fun.;We learned so much about the rich history of Chicago, the people who started the restaurants, the history of Chicago’s iconic foods: pizza, hot dogs, Italian beef sandwiches, this fires that destroyed Chicago and how the Chicago people rebuilt it time and time again.If you like good food, entertaining/educational presentations, this is definitely your kind of day trip!As I said our guide was Jeff who is a gifted storyteller with an endless vault of Chicago history.Ask for Jeff when you book your food adventure. He is an A+ guide.;5;8 janvier 2025;;94;1;0.9136;Positif;0.3125;0.5833333333333334;Positif;LABEL_1;0.9991341233253479
Fantastic tour, don’t let the cold deter you;Jeanine wea a great guide!  Lots of good food from deep dish pizza, beef sandwich, Garrett’s popcorn, Chicago dog, and the Palmer brownie. Every stop was well organize, and we stayed on track for the 3 hour time limit. Our guide was very entertaining.;5;1 décembre 2024;;45;1;0.8777;Positif;0.5375;0.665;Positif;LABEL_1;0.9996320009231567
Excellent way to see Chicago!;Even though it was 28°, we had a blast on this tour. Our guide, Jeff was informative, entertaining, and enthusiastic! Plenty to eat too, complete with snacks. Would highly recommend!;5;1 décembre 2024;;30;1;0.8357;Positif;0.34;0.635;Positif;LABEL_1;0.9996684789657593
Fun and food!;Our great tour guide was Jeff! He was friendly, informative, and fun. The food was good and plentiful. We are a family of two adults and two adult-ish children (19 years old) and we all enjoyed it!Thanks Jeff!;5;29 novembre 2024;;40;1;0.9623;Positif;0.384375;0.43125;Positif;LABEL_1;0.9996639490127563
A Must Do Tour!!;Such a fun tour. Julia was AMAZING and so knowledgeable. A great way to sample Chicago’s most popular culinary delights while learning about the city and its history. A must do tour!!;5;21 décembre 2023;déc. 2023 • En famille;33;1;0.9574;Positif;0.4;0.5357142857142857;Positif;LABEL_1;0.9996817111968994
Good one;Great tour. The food and drink were delicious and Our tour guide Mickey was fun and knowledgable! Would recommend.;5;20 décembre 2023;déc. 2023 • En solo;19;1;0.9274;Positif;0.7000000000000001;0.65;Positif;LABEL_1;0.9996787309646606
A Definite Must Wgile in Chicago;Absolutely wonderful! Our your guide, Mickey Jordan, was fantastic. So knowledgeable and fun. The tour itself was great. Hit several Chicago landmarks along with sampling of great food.;5;10 décembre 2023;déc. 2023 • Entre amis;28;1;0.9655;Positif;0.5499999999999999;0.6;Positif;LABEL_1;0.9996820688247681
Holiday walking food tour;We had a great time with our host Mickie, and the food portions were more substantial and delicious than we expected. We learned a lot about history and traditions of Chicago.;5;4 décembre 2023;;31;1;0.8795;Positif;0.5499999999999999;0.6625;Positif;LABEL_1;0.9996724128723145
A fun spirited way to spend a few hours getting familiar with Chicago and its non-foodie foods;A fun and informative way to experience Chicago’s famous non-foodie foods with a jovial and quick witted guide.  Josie entertained us and expedited our feasting at several local establishments on a very busy December Saturday.  As others may have already mentioned… do not eat much, if anything prior to this tour.  We were served nearly full portions at each of the stops.  Josie reeled off fun Chicago facts and kept us entertained as we made our way from one food stop to the next.  Her upbeat vibe made the tour a hit for us.;5;5 décembre 2022;;96;1;0.9022;Positif;0.19212121212121208;0.27636363636363637;Positif;LABEL_1;0.9995216131210327
The one tour to do without hesitation!;This is a must do tour whilst in Chicago! Josie our guide was so knowledgeable and made the tour fun for everyone. The food stops were amazing and Josie was able to answer all our questions without any hesitation. This walking tour gives you a great insight to what Chicago offers.  If you do just one tour do this one and upgrade to include the beers - you won’t regret it. Oh and also don’t eat too much before this walking tour as food portions are good sizes;5;1 décembre 2022;nov. 2022 • Entre amis;89;1;0.9452;Positif;0.4571428571428572;0.4678571428571429;Positif;LABEL_1;0.9995262622833252
Definitely recommend;"Josie was fabulous; even had some well times dad jokes 🤣 Was pleasantly surprised by the food portions and great beer selection. Loved the history and stories.";5;27 novembre 2022;nov. 2022 • En couple;26;1;0.9612;Positif;0.5;0.8625;Positif;LABEL_1;0.9994356036186218
Great fun!;Great fun. It ran just a little longer than we were expecting. Our tour guide Josie was great and fun and bubbly. Loved her;5;24 novembre 2022;;24;1;0.9623;Positif;0.4520833333333334;0.5333333333333333;Positif;LABEL_1;0.9996380805969238
Great holiday walking tour;Josie was very professional, fun, and entertaining. She had a good fund of knowledge about Chicago and places on the tour. Pace was just right, relaxed, but moving along when necessary. Different couples got to know each other during the tour and really enjoyed the places we visited. Highly recommended. Great for people from Chicago or people just visiting.We would gladly do this again and probably will!;5;22 novembre 2022;;68;1;0.975;Positif;0.3125595238095238;0.5942261904761905;Positif;LABEL_1;0.9996756315231323
In must see at Christmas;What a beautiful place to visit at Christmas!!!! It is amazing!!..... stands of Germany with crafts, watches, candy, coffee or teas!!.... Eat German sausages!!!!;5;28 décembre 2021;;24;1;0.8402;Positif;0.4833333333333334;0.6333333333333333;Positif;LABEL_1;0.9996355772018433
Yes;The tour guide was very helpful and kind. We enjoy the food experience and the information that he share with us. We recommend Dylan as a tour guide.Please let the tourists know who’s vaccinated or not. To make a knowledgeable decision if we take the tour or not or enforce the use of the face mask.Thanks;4;25 décembre 2021;;59;1;0.9575;Positif;0.35000000000000003;0.475;Positif;LABEL_1;0.9993748068809509
Awesome Tour;When I booked the tour I just wanna find some good food places.But our awesome Tour  Guide „Julia“ showed us the cool facts about Chicago and the food.The food stops on this tour: Billy Goat Tavern, Lou Malnati’s, Pizano’s and Sugar Bliss were delicious.For the final we went to the Christkindlmarket for some warm cider.;5;24 décembre 2021;déc. 2021 • En solo;60;1;0.9723;Positif;0.6083333333333333;0.8083333333333332;Positif;LABEL_1;0.9991858601570129
Great experience;It was great. Justin was very personable. The food part was great. Would have been good to know what beverages were being served ahead of time;4;12 décembre 2021;;26;1;0.9022;Positif;0.625;0.6000000000000001;Positif;LABEL_1;0.9995841383934021
Definitely a must do;We were so lucky to have Julia as our tour guide!  She really made it a great experience.  What an awesome personality and she was SO entertaining.The food was awesome.  A mark of a great food tour is when they take you to the original food spots, not just a copycat.  Plus, they pay for the food.  If the restaurant is giving away “free samples” to tour guides that is a bad sign.I look forward to taking other tours from this company.;5;5 décembre 2021;déc. 2021 • En famille;84;1;0.9824;Positif;0.41666666666666674;0.7113636363636364;Positif;LABEL_1;0.9988425970077515
Fabulous!;We loved this tour and we were able to eat some of the staples that Chicago is known for! We also learned a lot of history from our tour guide. We were also able to walk between food destinations which didn’t make it seem like we were eating too much!;5;25 novembre 2021;;51;1;0.7506;Positif;0.475;0.5625;Positif;LABEL_1;0.9995666146278381
Holiday Walk food stroll;Kevin the Christmas Elf did a fabulous job. He’s a personable guy with a ton of knowledge. He made for a memorable afternoon!;5;24 décembre 2019;;24;1;0.5267;Positif;0.45;1.0;Positif;LABEL_1;0.9996662139892578
Thank you Kevin!!!;Had a wonderful time, our guide was very knowledgeable and a bunch of fun. We are first timers to Chicago and learned a lot and ate at some very good places.;5;23 décembre 2019;;31;1;0.8805;Positif;0.532;0.5226666666666666;Positif;LABEL_1;0.9996877908706665
Christmas tour was;Noah did a great job.  Very interactive with the group.    Handled the crowds very well. Gave a lot of history and information about Chicago.   Noah was knowledgeable about the topics.    The hot chocolate was fabulous;5;14 décembre 2019;déc. 2019 • Entre amis;35;1;0.8718;Positif;0.37;0.64;Positif;LABEL_1;0.9996528625488281
Awesome tour;Just did the tour today. Food was good. Navigation was great and Noah did an awesome job. He should be commended. Good job!  Looking forward to coming back in the summer.;5;14 décembre 2019;déc. 2019 • Entre amis;31;1;0.9509;Positif;0.64;0.5900000000000001;Positif;LABEL_1;0.9996706247329712
Awesome tour with Justin;Our guide Justin was very informative and friendly.  We really enjoyed the food and drink we tried, would highly recommend this tour.;5;3 décembre 2019;nov. 2019;22;1;0.8705;Positif;0.30874999999999997;0.51;Positif;LABEL_1;0.9996758699417114
Great learning experience mixed with fun!;I've lived in the Chicago area my whole life and learned so many new, interesting facts about Chicago and its history. While doing so, we tried some great Chicago food and were able to see the city all dressed up for the holidays. We did this tour as a team building activity for work and we all had a blast! Our tour guide Sarah was very knowledgeable and fun and made this a wonderful experience.;5;27 décembre 2017;déc. 2017 • Voyage d'affaires;75;1;0.9559;Positif;0.4595959595959596;0.5255050505050505;Positif;LABEL_1;0.9996023774147034
LOVED THIS TOUR!;Sarah, our guide, provided a fascinating behind-the-scenes glimpse of Chicago landmarks and food hot spots.  Sarah’s historical knowledge of Chicago and engaging her delivery made this holiday stroll the highlight of our Christmas holiday. We loved visiting popular sites, as well as places off the beaten track.  Our plan is to return to Chicago and take the bike tour. Sarah’s interest in people and places made this tour fantastic!Our family highly recommends Bobby’s Bike/Hike Tour in Chicago!;5;27 décembre 2017;déc. 2017 • En famille;84;1;0.9805;Positif;0.31222222222222223;0.6933333333333335;Positif;LABEL_1;0.9996323585510254
Walking Tour - a new perspective !!;The walking tour with Adarius really provided a great taste of Chicago!  My husband and I came for the third year and were looking for something new to do on Sunday afternoon. Our walking tour guide Adarius was full of interesting facts and his pleasant personality made it a most enjoyable afternoon! Slice of Deep Dish Pizza, Bratwurst from the Christkindlmarket and Hot Apple Cider.  A slight negative - the market was so, so crowded that unfortunately we weren't able to look around much, and the lines were very long.  We stopped at Macy's and another beautiful stop at the Palmer House for a bit of history and a chocolate brownie! Ended the tour,  stopping where well known gangster/mobster frequented often!  The historic  story telling was entertaining and the stops festive and full of holiday cheer!;5;17 décembre 2017;;136;1;0.9615;Positif;0.2541919191919192;0.5206132756132756;Positif;LABEL_1;0.9989374279975891
Une soirée amusante !;Leur grande camionnette est venue nous chercher à l'hôtel Shelbourne (l'un des deux points de ramassage dans le centre de Dublin) et a conduit à la banlieue de Dublin pour le spectacle. Notre dîner était très bon, en particulier le dessert irlandais à la tarte aux pommes. L'alcool est supplémentaire. Le spectacle musical était excellent et divertissant avec un peu d'humour et de participation du public. Musiciens et danseurs très talentueux. Un musicien appelé « l’orchestre » était très doué avec les instruments trad irlandais.Il y a des salles de bains au même niveau au salon. C'était une soirée amusante. Ensuite, le chauffeur nous a conduits directement à notre hôtel.;5;31 octobre 2025;oct. 2025 • En couple;110;1;0.5719;Positif;0.3333333333333333;0.35555555555555557;Positif;LABEL_1;0.9991788268089294
Bon divertissement traditionnel irlandais;Nous sommes tombés sur ce lieu en cherchant une soirée traditionnelle irlandaise loin du centre de Dublin. Nous avons réservé des billets qui incluaient l'option de transport de Dublin au pub. Le trajet a duré environ 30 minutes et notre chauffeur nous a amusés tout au long du trajet. À notre arrivée, nous avons été montrés à notre table et peu après, nos commandes de boissons et de nourriture ont été prises. Étant donné que le lieu devait accueillir plus de 100 invités, la nourriture était délicieuse et bien présentée. Chacun des serveurs de table savait exactement ce qui avait été commandé ce qui démontrait la précision du service. Le divertissement pour la soirée était merveilleux. De brillants musiciens et danseurs traditionnels ont diverti le public tout au long de la soirée. C’est une belle soirée à ne pas manquer..;5;27 octobre 2025;oct. 2025 • En couple;141;1;-0.25;Négatif;-0.03333333333333333;0.2888888888888889;Neutre;LABEL_1;0.9995453953742981
Meilleur rapport qualité-prix pour un dîner et un spectacle irlandais traditionnels;"Le dîner et le spectacle était l'un des points forts de notre séjour à Dublin. Les choix alimentaires et les préparations étaient excellents. Les musiciens et les danseurs étaient de classe ""BROADWAY"". C'est une expérience à ne pas manquer pour ceux qui veulent goûter à la bonne cuisine irlandaise et voir la culture irlandaise à son meilleur.";5;15 octobre 2025;oct. 2025 • Entre amis;57;1;0.0;Neutre;0.0;0.0;Neutre;LABEL_1;0.9996277093887329
À voir absolument à Dublin;Une nuit très divertissante. La musique et la danse étaient super. Le repas irlandais authentique était délicieux et rassasiant. Service était excellent. Nous avons vraiment apprécié toute la soirée. Ce spectacle est un must pour tout visiteur à Dublin.;5;8 octobre 2025;oct. 2025 • En couple;39;1;0.7964;Positif;0.6666666666666666;0.8333333333333333;Positif;LABEL_1;0.9996801614761353
Musique et danses irlandaises;Fabuleuse soirée !  Le repas était très bon (3 choix d'entrée et 3 choix de plat principal), les musiciens sont fantastiques et les danseurs aussi.  Super ambiance, à recommander sans hésiter;5;5 août 2025;août 2025 • En solo;30;1;0.5994;Positif;0.3333333333333333;0.6666666666666666;Positif;LABEL_1;0.9996768236160278
Une excellente soirée;J'ai absolument tout aimé,  le groupe de 4 musiciens étaient incroyable, les danseurs aussi même si le niveau d'une n'était pas trop au rendez-vous.  Le reste était excellent;5;21 juillet 2025;;29;1;0.4939;Positif;1.0;1.0;Positif;LABEL_1;0.9996309280395508
Une des expériences les plus mémorables de notre voyage en Irlande;Ce fut l'une des expériences les plus mémorables de notre voyage en Irlande. Le groupe de Merry Ploughboy était extrêmement talentueux. Nous avons vécu une musique irlandaise très authentique ce soir-là. Il y avait aussi des danseurs qui se produisaient. Ils étaient très talentueux. Les hommes et les femmes dansaient. La nourriture et la bière étaient super. Personne dans notre groupe de 17 membres de la famille n'a été déçu. Je recommande vivement cette expérience, si vous avez le temps.;5;17 juin 2025;mai 2025 • En famille;81;1;0.8126;Positif;0.3333333333333333;0.6666666666666666;Positif;LABEL_1;0.9996682405471802
Divertissement absolument formidable, et assez bon repas / service;Quels grands amuseurs ! Le groupe et les danseurs étaient exactement ce que vous voulez dans une soirée à thème irlandais. Nous y avons assisté par une nuit très chargée, et c’est peut-être pourquoi notre repas n’était pas aussi chaud qu’il le devrait. Mais, je recommanderais quand même fortement ceci comme un excellent exemple de toutes les choses irlandaises merveilleuses.;4;27 mai 2025;;63;1;0.5719;Positif;1.0;1.0;Positif;LABEL_1;0.9996236562728882
Bonne nourriture avec un spectacle amusant!;Super moment à ce spectacle. On a un super dîner. Excellent groupe avec des chansons que la plupart des gens connaissent. Les danseurs étaient superbes et ont même pris les spectateurs de haut. Un grand moment !;5;17 avril 2025;avr. 2025 • En famille;36;1;0.9382;Positif;0.5416666666666666;0.8333333333333333;Positif;LABEL_1;0.9996801614761353
Joyeux laboureurs;Ce spectacle était incroyable ! Je recommande vivement ce spectacle lorsque vous êtes à Dublin! ! La danse était géniale et le groupe était encore meilleur !;5;7 avril 2025;avr. 2025 • Entre amis;24;1;0.0;Neutre;0.0;0.0;Neutre;LABEL_1;0.9996707439422607
Grande nuit au joyeux laboureur;Je recommande vivement d'être pris en charge par mini bus à l'extérieur de l'hôtel Shelbourne à l'heure, super chauffeur de mini bus et nous a déposés à la fin près de notre hôtel.La nourriture était excellente et tous avaient un goût si frais.Les musiciens étaient super, jouant des mélodies irlandaises et des différents instruments avec les grands danseurs qui arrivaient à mi-parcours.Vous ne serez pas déçu;5;2 avril 2025;;70;1;0.8316;Positif;0.3333333333333333;0.6666666666666666;Positif;LABEL_1;0.9996582269668579
Célébrations du 40e anniversaire;récemment séjourné à Dublin, nous avons réservé le spectacle du soir Merry Ploughboy avec repas. c'était incroyable la nourriture était délicieuse le divertissement était exceptionnel, il vaut bien l'argent, c'est aussi un excellent moyen de sortir de l'agitation du centre-ville et profiter d'un grand divertissement irlandais! je recommande vivement.;5;25 mars 2025;mars 2025 • Entre amis;50;1;0.8979;Positif;0.75;1.0;Positif;LABEL_1;0.9996626377105713
Super groupe irlandais et danseurs !;Super fun ! D'abord un repas , puis merveilleux groupe irlandais ( drôle et interactif ! J'ai adoré la musique ! ) et les danseuses irlandaises ! !Tout s'est terminé trop tôt !;5;16 mars 2025;mars 2025 • En famille;25;1;0.7717;Positif;0.31666666666666665;0.43333333333333335;Positif;LABEL_1;0.9996267557144165
Une nuit fantastique;Quelle nuit fantastique! Le repas de 3 plats était fantastique. Vous aviez le choix entre quelques articles pour l'entrée et pour le plat principal, et le dessert était le même pour tout le monde. La nourriture était tout simplement délicieux et beaucoup plus que ce à quoi nous nous attendions. Le groupe Merry Ploughboy était tout simplement merveilleux... Ils ont amené le public à participer avec certaines chansons et l'ont rendu plus agréable. Les danseurs sont si incroyablement talentueux et offrent un spectacle merveilleux.Ce paquet vaut vraiment bien l'argent. Si vous séjournez à Dublin, assurez-vous de vous allouer suffisamment de temps pour vous rendre sur place. Il n'est pas dans les limites de la ville de Dublin. Ne vous inquiétez pas d'être trop tôt car vous pouvez entrer et prendre place dans le bar et prendre votre verre en attendant que les portes s'ouvrent à l'étage.Si vous êtes en fauteuil roulant - lié ou avez des problèmes de mobilité, ne vous inquiétez pas. Il y a un ascenseur disponible, et ils ont un stand handicap dans les toilettes.;5;10 mars 2025;;180;1;0.25;Positif;0.1;0.23333333333333334;Positif;LABEL_1;0.999176561832428
