titre_avis;texte_avis;note_avis;date_avis;type_voyage;nb_mots;nb_phrases;vader_compound;vader_sentiment;textblob_polarity;textblob_subjectivity;textblob_sentiment;transformer_label;transformer_score
Excellent;Très bonne expérience, visite incroyable et le personnel est extrêmement gentil notamment Fahre. Je recommande fortement.;5;9 novembre 2024;nov. 2024 • Entre amis;16;1;0.0;Neutre;0.0;0.0;Neutre;LABEL_1;0.9996814727783203
Visite en croisière de nuit des principaux sites le long du Danube avec en plus du prosecco illimité, vraiment illimité;Nous avons terminé notre séjour à Budapest par cette croisière de nuit absolument magnifique ! Le prosecco est vraiment illimité, les serveurs et serveuses guettent vos verres vides et viennent les remplir !! Les paysages illuminés, merveilleux et des photos géniales avec le parlement hongrois , le pont des chaînes, château de buda etc… A faire dans votre séjour …;5;3 novembre 2024;;56;1;0.0;Neutre;0.0;0.0;Neutre;LABEL_1;0.9996379613876343
super voyage!!!!!;quelle belle expérience avec mon homme et mes enfants. en famille ou en couple l'île de Malte propose de très belles activités, cette île est magique, les locaux sont d'une telle gentillesse!nous y retournerons en amoureux!!!;5;12 août 2025;juil. 2025;37;1;0.0;Neutre;0.0;0.0;Neutre;LABEL_1;0.9996834993362427
Génial.;Magnifique journée. Ambiance au rdv. Bonne humeur, buvette, braise.L’équipage est super, nous n’avons pas vu le temps passé. Le buffet était très bon et copieux.;5;22 octobre 2024;mai 2024 • Entre amis;28;1;0.5994;Positif;0.3333333333333333;0.6666666666666666;Positif;LABEL_1;0.9996806383132935
Magnifique;Alors la balade etait sympa , le repas a bord moyen je vous conseille de prendre un snack au lagon bleu , et venir plutot pour le depart pour avoir une transatte et une place confortable ,Ca reste une belle balade et les lieux visiter et magnifique;5;2 octobre 2024;oct. 2024 • En couple;45;1;0.0;Neutre;0.0;0.0;Neutre;LABEL_1;0.9992289543151855
Soirée Catamaran;Super organisation. Le personnel est très sympathique. L'excursion en soirée est très agréable, beaux paysages et petite baignade !Nous recommandons le barbecue, très bon.Un très beau moment à Malte.;5;29 août 2024;août 2024 • En famille;30;1;0.5994;Positif;0.3333333333333333;0.6666666666666666;Positif;LABEL_1;0.9996728897094727
Une journée exceptionnelle;Top top même si c’est complet mais le nombre de personnes est très correct.. la meilleure activité que j’ai fait a Malte staff très gentil, le barbecue est aussi bon les prix des boissons très abordables la musique pas très forte je recommande ce catamaran;5;29 juillet 2024;juil. 2024 • En couple;47;1;0.3818;Positif;0.5;0.5;Positif;LABEL_1;0.9996551275253296
Belle expérience;Nous avons réservé cette excursion puisqu’il ne restait que ça. Le premier point positif est le prix. La moyenne d’une boat party est de 80€, nous avons payé moitié prix ici. Le barbecue proposé le soir à 15€ est servi en grande portion avec une boisson à côté. Le personnel à bord était souriant, à l’écoute et intéressant. Je suis allée une fois au Blue Lagoon à l’aide d’un ferry et j’ai détesté cette expérience car trop de monde toute la journée. Cependant, avec cette excursion, nous sommes arrivés vers 18h et il ne restait presque plus personne et il y avait encore du soleil. Le bateau était propre. Le seul point « négatif » est qu’il distribue les boissons dans des verres en plastiques ce qui est très mauvais pour l’environnement. La musique n’était ni trop forte ni trop basse et le bateau est assez grand pour pouvoir s’allonger et profiter du soleil.;5;23 juin 2024;juin 2024 • Entre amis;162;1;0.7506;Positif;0.25;0.55;Positif;LABEL_1;0.9915342926979065
Impec;une balade paisible et magnifique, agréable à faire seule, avec amis ou en famille. Vous pouvez avoir un repas pour 15€. Le paysage et les pauses sont magnifiques ! Avec toilettes ( très propre). Mon avis personnel c’est la musique, j’aurais aimé que sa bouge plus 😂 mais sinon 5/5 !;5;18 juin 2024;;50;1;0.0;Neutre;0.0;0.0;Neutre;LABEL_1;0.9995867609977722
Parfait pour ceux qui ont le mal de mer car très stable;Nous avons choisi la formule sunset pour le coucher du soleil et c'était vraiment génial.Les destinations sont assez touristiques mais à l'heure à laquelle on y passe il n'y a pas trop de monde c'est ce qu'il fait toute la différence.Je vous conseille de prendre sur place le barbecue qui était vraiment excellent et suffisant en terme de quantité (je fais 110kg).Le patron qui est toujours sur le bateauet est vraiment super sympa ainsi que très bonne ambiance.Il est très à l'écoute si vous voulez discuter.Les prix sur le bateau sont très abordables.;5;31 mai 2024;mai 2024 • En couple;98;1;0.8225;Positif;0.6666666666666666;0.8333333333333333;Positif;LABEL_1;0.999372661113739
Top;Super balade pour la journée le seul bémol trop de monde sur le bateau.Pas d’arrêt en ville uniquement en mer pour se baigner.Très beau paysage et bateau ambiancéLe repas du midi est top;5;3 janvier 2024;juin 2023 • Entre amis;36;1;0.6908;Positif;0.41666666666666663;0.5833333333333333;Positif;LABEL_1;0.999453604221344
Journée agréable  mais sans plus;Journée agréable  sans plus . Pas de quoi s extasier . Seules les 2 baignades en novembre dans les 2 lagons sont sympa . Sinon dommage le bateau est trop gros pour passer dans les grottes . Repas correct : une assiette avec crudités , 2 brochettes poulet et des féculents .Pour nous ce serait mieux avec un petit bateau;4;3 novembre 2023;;54;1;0.0;Neutre;0.0;0.0;Neutre;LABEL_1;0.7028155326843262
Géniale;Parfait pour une journée bateau, possibilité de manger sur place avec l’option végétarien. Cigarette interdite sur le bateau mais vapote en vente sur place. On s’arrête dans les plus beaux endroits je recommande;5;1 octobre 2023;;35;1;0.0;Neutre;0.0;0.0;Neutre;LABEL_1;0.9995125532150269
Tour en catamaran;Beaucoup de monde à bord. Bruyant, notamment 1 groupe d’environ 10 personnes qui pensaient être seuls sur le bateau !Le responsable du bar n’était pas très sympathique, comparé au reste de l’équipage qui eux, l’étaient. Le barbecue pour 15€ avec 1 boisson comprise était bon.Je ne referai pas. J’opterai pour un tour un peu plus privé.;3;22 septembre 2023;sept. 2023 • En couple;62;1;0.0;Neutre;0.0;0.0;Neutre;LABEL_0;0.5913777947425842
Super journée  inoubliable.;Belle journée à bord du sée blue ,parfait pour une journée détente en bateau. Il est légèrement plus cher mais cela en vaut la peine visite du lagon bleu on se croirait dans les Caraïbes. Temps de baignade idéal en cette période les méduses sont très nombreuses mais inoffensives d'ailleurs c'est une attraction nous 'es avons prises en main.Petit conseil venez au rendez-vous une heure à l'avance pour avoir les places sur le filet à l'avant c'est le top.N'hésitez pas!Prix 65 euros pp.;5;16 septembre 2023;;87;1;0.5859;Positif;0.2222222222222222;0.3111111111111111;Positif;LABEL_1;0.9993287324905396
Incroyable;Super baladeBateau très propreLe temps des pauses baignade est parfaiteL’équipage très agréableLe BBQ est très bonSuper organisationOn ne peut que recommanderEt les paysages magnifiquesMerci 🤩S’il devait y avoir un bémol c’est l’heure de retourOn serait bien resté plus longtemps 😁;5;14 septembre 2023;;43;1;0.5994;Positif;0.3333333333333333;0.6666666666666666;Positif;LABEL_1;0.9996622800827026
A faire;Super fin d après midi. Expérience très agréable. 2 spots bien choisis pour la baignade avec assez de  temps pour bien profiter. Nous avions pris l option barbecue à bord. Très copieux. Le retour de nuit a aussi été très agréable,  avec un fond de musique lounge très sympa. Je recommande d arriver de bonne heure pour pouvoir être en haut, ce sont à mon avis les meilleures places. Activité très facile d'accès depuis la valette sans voiture..;5;26 août 2023;août 2023 • En famille;78;1;0.8176;Positif;0.3333333333333333;0.6666666666666666;Positif;LABEL_1;0.9996498823165894
Agréable moment;Moment agréable passé en couple.Nous avons pu avoir une place à l’amont du catamaran sans difficulté. Pas mal de personnes sur le catamaran mais qui n’empêche pas de passer un moment agréable sans être les uns sur les autres et proximité écrasante.Rien à reprocher aux personnels présents.Balade de 6h en tout. 3 spots turquoise visités. Spots très beau, possibilité de se baigner sans difficulté aucune.Possibilité de demander un masque/tuba pour visionner les fonds en échange d’une caution/carte d’identité pour la dure du prêt. Stock suffisant pour tous.À refaire !;5;23 août 2023;;99;1;-0.3818;Négatif;0.0;0.0;Neutre;LABEL_1;0.9994533658027649
Merci pour cette belle journée !!;Top !! Bien mieux que le quad !!Le service est top !Le bateau très bien entretenu et très propre.Le service bar à prix non excessif.Les spots de nage plutôt sympa !!Les délais entre chaque spot très bien.Nous n’avons pas pris le repas à bord car il s’agit généralement d’un attrape touriste pour facilement se faire de l’argent et pour le coup, nous l’avons regretté. Les assiettes étaient bien pleines, et le plat avait l’air d’être très bon. (Poulet assaisonné au barbecue et légume) Pour 15€ je pense que c’était un très bon rapport qualité / prix. Nous l’aurions prix si j’avais fait plus attention aux avis !Attention comme il est indiqué, il faut arriver 45 min - 1heure avant pour être sûr d’avoir une place confortable.La balade à durée 6h comme mentionnée.La meilleure activité de l’île pour nous;5;23 août 2023;;152;1;0.3818;Positif;0.5;0.5;Positif;LABEL_1;0.9991596937179565
BELLE ACTIVITÉ;Nous avons passé un excellent moment en excursion sur le catamaran. Durée 5h, de 16h30 à 21h30 avec vue sur le coucher du soleil au Top !Barbecue copieux pour le repas du soir avec musique d’ambiance sur le bateauPetit conseil : arrivez une heure minimum pour tenter d’avoir une place sur les transats au dessus.Il serait bien aussi d’installer une file d’attente afin d’éviter de se piétiner dessus à l’entrée sur le catamaran pour avoir sa place…Thank you very much, have a nice day !;5;12 août 2023;;91;1;0.8768;Positif;0.59;0.69;Positif;LABEL_1;0.9995887875556946
Balade sympa;Balade en bateau très sympaUn peu déçue par les paysages « surcotés »Sinon, bateau très propre !!;3;4 août 2023;août 2023 • En famille;15;1;0.0;Neutre;0.0;0.0;Neutre;LABEL_1;0.9993963241577148
trop bien!;Trop bien! Une bien belle promenade en catamaran pour découvrir de beaux endroits et d'y baigner. Le déjeuner barbecue en option était très bon.;4;2 août 2023;juil. 2023 • En famille;24;1;0.0;Neutre;0.0;0.0;Neutre;LABEL_1;0.999626636505127
Excursion parfaite;Super journée, très bonne équipe et bon point de baignade. : Blue Lagon et Crystal Lagon et point sur le retourTrès bon repas et copieux et coktail au top;5;1 août 2023;;28;1;0.6908;Positif;0.27777777777777773;0.4222222222222222;Positif;LABEL_1;0.9996744394302368
Nous avons 3 arrêts mais nous avons été déçu de ne pas s’être approché du Lagoon nous étions trop loin. Le bateau est be;Nous avons 3 arrêts mais nous avons été déçu de ne pas s’être approché du Lagoon nous étions trop loin. Le bateau est beau mais plein. Le repas était très bon et bien organisé. A part l’arrêt de 20 min à Popeye les arrêts n’étaient pas top !;3;30 juillet 2023;juil. 2023 • En couple;50;1;0.2023;Positif;0.5;0.5;Positif;LABEL_1;0.9975957274436951
Beau moment d’évasion;Très bien organisé. Arriver 45 minutes pour choisir sa place. Attention les sièges sont pour deux personnes. Pas de plongeoir. Equipage efficace. Bateau très agréable avec un bar avec des des prix corrects. Repas le soir également très bien organisé et de bon rapport qualité prix. Très belle ballade jusqu’au village de Popeye puis ensuite deux autres arrêts intéressants dont le lagon bleu. A chaque mouillage on peut se baigner. Bateau très propre. Bonne ambiance sur le bateau. Pas l’impression de se sentir oppressé. Plus cher que les autres ballades en bateau mais prestation de qualité donc le prix est justifié.;5;30 juillet 2023;juil. 2023 • En famille;103;1;0.2263;Positif;0.0;0.0;Neutre;LABEL_1;0.9994648098945618
A faire!;Top service parfaitArrivés tôt pour avoir une bonne placeLes arrêts étaient super et éloignés de la foule pour nager tranquillement.Le repas du midi très bien.;5;30 juillet 2023;juil. 2023 • En famille;26;1;0.6908;Positif;0.41666666666666663;0.5833333333333333;Positif;LABEL_1;0.9996486902236938
Perfect sunset;Super expérience, une bonne ambiance et des vues à couper le souffle, le BBQ était à notre goût  ! Nous recommandons !;5;29 juillet 2023;juil. 2023 • En couple;20;1;0.5994;Positif;0.3333333333333333;0.6666666666666666;Positif;LABEL_1;0.9996697902679443
Très sympa;Très belle excursion. Pas trop de monde, juste ce qu’il faut . L’avantage au coucher du soleil c’est qu’il y a moins de monde. Barbecue copieux et musique très sympa. Bonne ambiance;4;29 juillet 2023;;35;1;0.0;Neutre;0.0;0.0;Neutre;LABEL_1;0.9991931319236755
Balade et baignade inoubliables !;Très belle balade en mer avec des lieux de baignade incroyables.Conseil : arrivez de bonne heure pour choisir votre place sur le bateau (ça conditionne tout le reste).Repas servi à bord très bien;4;28 juillet 2023;;34;1;-0.128;Négatif;0.0;0.0;Neutre;LABEL_1;0.9995993971824646
Journée parfaite;Très belle journée à bord de ce catamaran. Les lieux visités sont à couper le souffle. Je pense que les photos parlent d’elles-mêmes !;5;26 juillet 2023;;25;1;0.0;Neutre;0.0;0.0;Neutre;LABEL_1;0.9996647834777832
Sortie catamaran comito blue lagoon;Sortie en catamaran très agréable, le barbecue propose en supplément très copieux et bien organisé. Petit bémol pour l'organisation pour embarquer: j'avais la réservation sur mon téléphone mais nulle part il était indiqué qu'il fallait aller chercher des tickets à leur stand. J'etais bien placé dans la queue pour monter sur le bateau et ainsi choisir une bonne place, il y a fallu que je retourne chercher des tickets.;4;24 juillet 2023;juil. 2023 • En famille;69;1;0.0;Neutre;0.0;0.0;Neutre;LABEL_1;0.9962717294692993
Top balade;Très sympa à faire, très beau paysage et arrêts pour baignade au top !  Musique sympa sur le bateau !;5;18 juillet 2023;juil. 2023 • En famille;18;1;0.2023;Positif;0.5;0.5;Positif;LABEL_1;0.9996565580368042
Super sympa;Très bien organisé. Personnel très sympathique. Acceuil chaleureux. Quoi de demander de mieux, au départ du port de la Grande-Motte.;5;11 juillet 2023;;21;1;0.0;Neutre;0.0;0.0;Neutre;LABEL_1;0.9996546506881714
Super;Le barbecue très bon. On a fait plusieurs arrêts avec des points de vue magnifiques. Attention faut venir une heure avant pour avoir les transats. Nous c’était pas le cas donc on est allés sur le trampoline (encore mieux!)Musique house, on a adoréPoint négatif pour l’arrêt 5 minutes devant popeye village, on aimait pas et ça nous a rajouté du trajet;5;5 juillet 2023;juil. 2023 • Entre amis;64;1;0.0;Neutre;0.0;0.0;Neutre;LABEL_1;0.9985466599464417
Très bonne journée sur ce catamaran;Superbe journée sur ce beau catamaran, le barbecue du midi était très bien pour 15 euros, très bonne ambiance, de la musique mais pas trop forte. Je vous conseille de venir 1h avant pour avoir une bonne place.;5;3 juillet 2023;juin 2023 • En couple;38;1;0.0;Neutre;0.0;0.0;Neutre;LABEL_1;0.9995881915092468
Belle journée sur l’eau;Très belle journée sur l’eau le BBQ était bon et copieux les arrêts bien choisis pour pouvoir nager le soleil au rendez-vous;5;15 juin 2023;;24;1;0.0;Neutre;0.0;0.0;Neutre;LABEL_1;0.9996596574783325
Agréable journée;Bonne journée au sein de ce catamaran qui est très propre.Le personnel de bord est sympathique, le déjeuner est  bon avec une quantité suffisante.Petit bémol pour le prix des glaces et l'heure du retour (15h30, il me semblait que le retour était prévu à 17h) .J'aurais bien aimé visiter l' autre côté du blue lagon.Bonne continuation à toute l' équipe;4;14 juin 2023;;63;1;0.0;Neutre;0.0;0.1;Neutre;LABEL_1;0.9994064569473267
Parfait.;Tout s’est très bien passé équipage sympa et ambiance festive ! Les visites étaient magnifiques ! Et la baignade un peu fraîche mais époustouflante !;4;11 juin 2023;juin 2023 • En couple;23;1;0.3612;Positif;0.0;0.0;Neutre;LABEL_1;0.9996720552444458
Superbe balade en catamaran;Super balade, ambiance relaxante et visite des lagoon et de comino. On a pu profité d’un magnifique couché de soleil. Petit bémol le lagoon est rempli de méduse et il faut arriver au minimum 40 min à l’avance pour avoir des places sur les transats.;4;31 mai 2023;mai 2023 • Entre amis;47;1;0.4215;Positif;0.3333333333333333;0.6666666666666666;Positif;LABEL_1;0.9995700716972351
Super excursion;On a passé un très bon moment .Le catamaran est très confortable , le personnel est très sympa .Magnifique vue et arrête baignade .Je recommande;5;28 mai 2023;;24;1;0.0;Neutre;0.0;0.0;Neutre;LABEL_1;0.9996755123138428
Activité EVJF;Expérience agréable, arrêts dans plusieurs petites criques, barbecue avec brochettes de poulet + divers accompagnements (salade de pâtes, crudités, semoule, ...). Musique pas trop forte. Équipe très sympa !;5;7 mai 2023;mai 2023 • Entre amis;26;1;0.0;Neutre;0.0;0.0;Neutre;LABEL_1;0.9995298385620117
Paysage magnifique;Des paysages à couper le souffle.Un bateau confortable, propre, et bien équipé.Dommage que les accompagnements du barbecue n’était pas à la hauteur.Pensez à prendre une petite veste car il y a du vent;4;2 mai 2023;mai 2023 • Entre amis;37;1;0.0;Neutre;0.0;0.0;Neutre;LABEL_1;0.9993019104003906
Génial Alhambra;Sandra était brillante, très claire et concise, très instructive. Elle s'occupait très bien de son groupe. Nous avons beaucoup appris sur le palais et la région de Grenade, vraiment apprécié;5;28 octobre 2025;oct. 2025 • En couple;30;1;0.0;Neutre;0.1;0.6;Positif;LABEL_1;0.9996681213378906
Un site incontournable et une grande visite.;Visite instructive pour vous donner l'histoire et une belle promenade à travers le site. je recommanderais cette visite à tous mais il y a une petite section en montée au départ à négocier que la plupart seront en mesure de gérer. Nous avons apprécié les jardins et vous pourriez passer une journée entière à explorer le site à son maximum.;5;26 octobre 2025;oct. 2025 • En couple;60;1;0.0;Neutre;0.0;0.0;Neutre;LABEL_1;0.9995961785316467
Alhambra;Point positif : guide sympathique, très bonnes explications, souriante et passionné.Point négatif: pas de précision qu’il y a 30 minutes de marche en monté. Pour nous pas un soucis mais certaines personnes ont du monter en taxi et du coup n’ont pas eu les explications.;4;14 octobre 2025;oct. 2025 • En couple;47;1;0.0;Neutre;0.0;0.0;Neutre;LABEL_1;0.9975247979164124
Vaut le détour;Notre guide était très compétent et attachant. Le Palais de l'Alhambra est un endroit à ne pas manquer l'histoire et les vues sont vraiment incroyables. J'ai particulièrement aimé les jardins.Le point de collecte était un peu difficile à trouver. Nous avions supposé que ce serait près de la billetterie en dehors de l'Alhambra, mais c'était assez loin ce qui a rendu la visite intéressante que vous marchez jusqu'à l'approche du site. Il est tout à fait une colline donc vous avez besoin d'une forme physique raisonnable. Heureusement, nous avions fait un essai de localisation du point de collecte.;5;26 juin 2025;juin 2025 • En couple;99;1;-0.128;Négatif;0.0;0.0;Neutre;LABEL_1;0.9985180497169495
Expérience moyenne;Le vendeuse billets est nul. Il faut prendre un taxi depuis l Alhambra et en reprendre un autre pour revenir à la billetterie. Pas aimable et injoignable au téléphone. Avons perdu une heure;3;24 juin 2025;juin 2025 • Entre amis;33;1;0.0;Neutre;0.0;0.0;Neutre;LABEL_0;0.9855964779853821
Honte à vous Tripadvisor;J’écris cet avis parce que vous (Tripadvisor) qui possédez Viator n’avez pas envoyé les détails de mon passeport pour jouer à Grenade lorsque j’ai réservé le voyage il y a 2 semaines et à cause de ce jeu Grenade n’avait pas d’autre choix que d’annuler ma réservation et de rembourser ma réservation 2 jours avant qu’elle ne commence , donc je suis allé jusqu’à Grenade sans voir le point culminant de la ville , je pense que c’est honteux au nom de Tripadvisor (viator ) et je ne réserverai plus jamais par eux ! Ne réservez rien via TRIPADVISOR;1;22 mai 2025;;104;1;0.0;Neutre;0.0;0.0;Neutre;LABEL_0;0.9802307486534119
Expérience très décevante..a ne pas renouveler;Alhambra était magnifique c’est juste la réservation des billets qui était nulle.Avions réservé à 15 h avec guide….la veille on nous dit que c’est annulé.Mais on nous propose des audio guides….(avec notre téléphone)….nous avons dû faire 6kms en plus pour chercher les billets.Trop déçu par ce site.;1;18 mai 2025;mai 2025 • Entre amis;55;1;0.0;Neutre;0.0;0.0;Neutre;LABEL_1;0.9160855412483215
Visite de l’alhambra que vous avez annulé;Je suis très déçue de cette expérience avec vous car vous m’avez annulé la réservation pour raisons techniques et que je n’ai pas eu le remboursement;1;14 mai 2025;mai 2025 • En couple;28;1;0.0;Neutre;0.0;0.0;Neutre;LABEL_0;0.9880214929580688
Un MUST à visiter.;L’alhambra de Grenade est un incontournable et est une merveille à visiter.À distance de marche de la Place Nueva, c’est une belle activité à faire. Cependant, il faut être un peu  en forme (ou prendre son temps) et ce en raison de la montée et des marches. Une fois rendue, c’est un charme à visiter.La visite avec un guide est très intéressante mais elle peut être laissé de côté si l’on veut juste visiter et que l’on connaît un peu de l’histoire de l’Alhambra.Faites attention, l’entrée à certains monuments via un guide est limitée à uniquement un passage et parfois le guide laisse de côté certains aspects ( ex. La haute tour de l’Alcazaba). Le guide nous avait dit que l’on pourrait y retourner sans problème mais la sécurité nous a indiqué que c’était uniquement un passage. Légère déception de notre côté.;4;8 mai 2025;;155;1;0.0;Neutre;0.0;0.0;Neutre;LABEL_1;0.9813180565834045
Grotesquement hors prix;Prestation correcte, guide intéressante, mais prix grotesquement prohibitif : 128 € / pers, pour une entrée à 10€ SANS LES PALAIS NASRIDES et une guide pour un groupe de ~20 pers. À éviter ! Réservez à l’avance;1;6 mai 2025;mai 2025 • En couple;34;1;0.0;Neutre;0.0;0.0;Neutre;LABEL_1;0.9679211974143982
Grosse arnaque;Une énorme arnaque et surtout très grosse désillusion! Faute d’avoir trouvé des billets sur le site officiel de l’alhambra nous étions trop content de dépenser 159e, même pour seulement 2  billets pour découvrir ce lieu incroyable!Raté, alors que sur la commande tripadvisor il était écrit « visite alhambra et generalife » nous n’avons pas pu visiter la meilleur partie c’est à dire les palais nasrides à l’intérieur de l’alhambra. Nous n’avons pu voir que les extérieurs (generalife et alcazaba)!C’est comme acheter un billet pour le Louvre et avoir droit à une visite extérieur du bâtiment sans voir les peintures! Un scandale que le personnel de l’alhambra connaissait bien, ils étaient navrés pour nous et nous on dit de dénoncer ces arnaques très très connues et acheter son billet uniquement sur le site officiel.;1;6 mai 2025;mai 2025 • En couple;142;1;-0.7351;Négatif;0.0;0.0;Neutre;LABEL_0;0.9874843955039978
Super visite;Incroyable visite de la belle Alhambra - notre guide (je ne me souviens pas de son nom mais elle tchèque! ) était très bien informé et engageant et a rendu l'expérience si intéressante;5;28 avril 2025;avr. 2025 • En couple;31;1;0.0;Neutre;0.0;0.0;Neutre;LABEL_1;0.9996356964111328
Achat ne représentait pas ce qui a été montré en ligne.;J'ai acheté un billet après avoir vu les photos en ligne pour découvrir que les photos en ligne sont à l'intérieur de l'Alhambra et mon billet hors de prix n'incluait pas l'intérieur de l'Alhambra. C'était très décevant et trompeur. Les photos montrées sur l’excursion doivent représenter ce qui est inclus dans la visite.;1;26 avril 2025;;54;1;0.0;Neutre;0.0;0.0;Neutre;LABEL_1;0.9958556294441223
L’alhambra, un lieu incontournable;Nous avons passé un excellent moment avec Dara, notre guide.De belles découvertes dans un moment décontracté.L’Alhambra est un lieu incontournable de l’Andalousie, pour son histoire et la beauté des lieux.Très agréable de déambuler dans ces lieux sans être confrontés au tourisme de masse.Un bémol pour l’accueil froid de Play Granada. Peut être un coup de pas chance.;4;26 avril 2025;avr. 2025 • En couple;64;1;0.7964;Positif;1.0;1.0;Positif;LABEL_1;0.9996392726898193
Alhambra la Magnifique !;Endroit magnifique et notre guide Maria Carmen était très intéressante et attentive au groupe. L’endroit et immense et sans guide, nous n’aurions pas pu apprécier autant.;5;25 avril 2025;;28;1;-0.2732;Négatif;0.2;0.95;Positif;LABEL_1;0.9996522665023804
Mauvaise présentation et livraison;Guide touristique n'était pas très impressionnant. N'avait pas une bonne compréhension de la langue anglaise ou ne présentait pas le matériel de manière intéressante.Très dispersé;2;27 décembre 2024;;26;1;0.0;Neutre;0.0;0.0;Neutre;LABEL_1;0.9379642009735107
