titre_avis;texte_avis;note_avis;date_avis;type_voyage;nb_mots;nb_phrases;vader_compound;vader_sentiment;textblob_polarity;textblob_subjectivity;textblob_sentiment;transformer_label;transformer_score
Grande activité;Ana était charmante, joyeuse et a raconté des faits intéressants.Merci. . . . . . . . . . . . . . . . . . . . . . . . . . . . . . . . . . . . . . . . . . . . . . . . . . . . . . . .;5;2 novembre 2025;oct. 2025 • En famille;11;1;0.0;Neutre;0.0;0.0;Neutre;LABEL_1;0.9996722936630249
Tour Eiffel avec des amis sans stress;"La Tour Eiffel a été absolument mémorable ! Notre guide, Ana Bauk, a donné vie à l’histoire de la tour grâce à son récit perspicace. J’ai adoré à quel point l’expérience était interactive; nous n’écoutions pas seulement — Ana encourageait les questions et partageait des anecdotes fascinantes qui donnaient à notre groupe l’impression d’être connecté.Faire des pauses aux premier et deuxième niveaux nous a permis de savourer une vue imprenable sur Paris tout en explorant les expositions et en dégustant des collations. Je recommande vivement le surclassement au sommet! Les vues panoramiques sont à couper le souffle, surtout depuis le trop.";5;12 octobre 2025;oct. 2025 • Entre amis;106;1;0.1027;Positif;0.0;0.0;Neutre;LABEL_1;0.9996590614318848
Tour Eiffel pluvieux mais amusant !;Nous avons fait la visite de la Tour Eiffel avec Janani. Même si nous avons eu une journée très pluvieuse et venteuse qui a entraîné la fermeture du sommet, nous avons quand même passé un très bon moment. La compagnie de guides touristiques était organisée et nous a rencontrés à temps. Notre guide Janani était bien informé et très bien préparé. Elle nous fave de grandes informations sur Eiffel avec des détails intéressants. Elle a rendu les choses amusantes et divertissantes malgré le temps!;5;4 octobre 2025;oct. 2025 • En famille;84;1;0.4404;Positif;0.0;0.0;Neutre;LABEL_1;0.999525785446167
Expérience mémorable;Même s'il y avait une longue file d'attente, la guide a rendu la visite rapide, amusante et mémorable avec ses blagues. Vous êtes reconnaissant pour l’expérience et vous recommandez d’y aller avec Kato.;5;30 septembre 2025;sept. 2025 • En famille;35;1;0.0;Neutre;0.0;0.0;Neutre;LABEL_1;0.9995540976524353
*****;Nous avons eu une expérience incroyable sur notre tour de la Tour Eiffel avec Ana! Elle était très attentive, s'assurant que tout le monde se sentait à l'aise et inclus. Ana a partagé tant de faits et de points de vue intéressants qui ont rendu la visite encore plus mémorable. Ses connaissances et sa gentillesse se sont vraiment distinguées. Nous recommandons totalement Ana comme guide - elle a rendu notre visite inoubliable!;5;29 septembre 2025;sept. 2025 • En famille;71;1;-0.128;Négatif;0.4;0.9;Positif;LABEL_1;0.9996777772903442
Bon tour;Nihad était un grand guide touristique. Connaissance et amical. Je nous ai donné d'excellents conseils puisque je n'avais jamais vu la visite avant. Aurait été bon que le billet inclue l'accès au dernier étage;5;27 septembre 2025;sept. 2025 • En couple;34;1;0.4588;Positif;0.5;1.0;Positif;LABEL_1;0.9995766282081604
Escalade des marches de la tour Eiffle;Escalader la Tour Eiffel a été une expérience inoubliable qui a répondu à toutes les attentes, puis à certaines. J'ai choisi de monter les escaliers jusqu'au deuxième niveau, et même si c'était physiquement exigeant, le sentiment d'accomplissement à chaque pas en valait la peine.;5;26 septembre 2025;sept. 2025 • En famille;44;1;0.0;Neutre;0.0;0.0;Neutre;LABEL_1;0.9995425939559937
Titre: Visite exceptionnelle de la Tour Eiffel – Une expérience incontournable !;Le guide de la Tour Eiffel était excellent, bien informé, attachant et bien organisé. Ils ont partagé des informations historiques fascinantes, ont aidé à éviter les longues files d'attente et ont rendu l'expérience fluide et mémorable. Hautement recommandé pour tous ceux qui veulent plus qu'une simple visite typique.;5;25 septembre 2025;sept. 2025 • En famille;48;1;0.5719;Positif;0.5;0.6785714285714286;Positif;LABEL_1;0.999671220779419
Tour Eiffel 2ème étage;Je suggère aux guides d’avoir un micro et aux visiteurs un conseil sonore lié au micro du guide.C'était une journée très pluvieuse et parfois nous ne pouvions pas entendre ce que le guide racontait.;4;20 juillet 2025;juil. 2025 • En famille;36;1;0.0;Neutre;0.0;0.0;Neutre;LABEL_1;0.7120959162712097
Très bonne expérience;Joanna était juste incroyable. Elle était très bien informée et a tout expliqué vraiment bien. Nous sommes restés jusqu'à la fin de la visite pour entendre toutes les bonnes informations qu'elle avait.;5;16 juin 2025;mai 2025 • Entre amis;32;1;-0.128;Négatif;0.0;0.0;Neutre;LABEL_1;0.9996472597122192
Sommet de la Tour Eiffel;Super expérience avec notre guide Joanna T !! Elle nous a bien expliqué les détails de la construction de la Dame de Fer, très intéressant ! 🤩🤩;5;9 juin 2025;juin 2025 • En couple;24;1;0.5994;Positif;0.3333333333333333;0.6666666666666666;Positif;LABEL_1;0.9996600151062012
Le guide a mis beaucoup d'efforts pour rendre l'expérience mémorable;Le guide touristique Sagar était incroyable. Son humour et ses connaissances étaient formidables! Ses talents de photographe et son engagement ont rendu l'expérience encore meilleure!;5;18 mai 2025;mai 2025 • En solo;25;1;0.8442;Positif;0.0;0.0;Neutre;LABEL_1;0.9996592998504639
Thank you Joanna;Merci à Joanna pour son professionnalisme, sa connaissance, sa sympathie. Merci beaucoup.Très belle visite de la Tour Eiffel;5;8 mai 2025;mai 2025 • En famille;19;1;0.0;Neutre;0.0;0.0;Neutre;LABEL_1;0.9996767044067383
Merci Ana !;Ana - un super accompagnement et une attention toute particulière, Ana a tout fait pour nous faire passe un bon moment, malgré les 3 heures d'attente. Merci encore;5;2 mai 2025;mai 2025 • En famille;27;1;0.5267;Positif;0.3333333333333333;0.6666666666666666;Positif;LABEL_1;0.999667763710022
Super guide tour effeil;Ce n’était pas la première fois pour nous mais pour les enfants oui. En effet superVue mais surtout super guide un grand merci à Nathalia encore une fois pour ses histoires son sourire et sa bonne humeur;5;1 mai 2025;avr. 2025 • En famille;38;1;0.7845;Positif;0.41666666666666663;0.8333333333333333;Positif;LABEL_1;0.9996802806854248
Top;Top du top ! Ma famille et moi avons adoré cet endroit !  Nous reviendrons sans hésiter pour profiter de ce paysage  époustouflant !;5;26 avril 2025;mars 2025 • En famille;21;1;0.5106;Positif;0.5;0.5;Positif;LABEL_1;0.9996709823608398
Sagar est un garçon de sucre;Sagar était super. J'apprends beaucoup de choses et passe un bon moment. La Tour est béatiful et l'expérience de la visite guidée le transformer mieux;5;16 avril 2025;avr. 2025 • En famille;25;1;0.5994;Positif;0.3333333333333333;0.6666666666666666;Positif;LABEL_1;0.9996351003646851
Tour Eiffel;Merci à Masha pour la visite, cetait super ⭐️⭐️⭐️⭐️⭐️Très bonnes explications, très pro, rigolote, agréable, je recommande;5;12 avril 2025;avr. 2025 • En famille;17;1;0.5994;Positif;0.3333333333333333;0.6666666666666666;Positif;LABEL_1;0.9996786117553711
Tour Eiffel au sommet avec visite guidée;On a bien été accueilli et le Guide (Fortune) était très sympa et a tout bien expliqué 👍🏻Expérience à refaire absolument !La vue du sommet était magnifique !;5;11 avril 2025;avr. 2025 • En famille;27;1;-0.128;Négatif;0.0;0.0;Neutre;LABEL_1;0.9996645450592041
Ana vous fera aimer Paris un peu plus !;Ana était un très bon guide! Elle a gardé notre groupe uni et a fourni beaucoup de bonnes informations! Nous avons apprécié son comportement amical. Elle a donné un enthousiasme pour chaque détail et nous a tous fait aimer Paris un peu plus.;5;10 avril 2025;avr. 2025 • En couple;43;1;0.0;Neutre;0.0;0.0;Neutre;LABEL_1;0.9996576309204102
Le ventilateur à vis et rivets;Nous avons eu une grande expérience. Martin était le guide parfait, nous tenant divertis et informés. Il avait du temps pour tout le monde dans notre groupe très diversifié. Nous avons beaucoup appris sur la Tour Eiffel, notamment qu'elle en possède 2 . 5 millions de rivets. Ce qui a rendu ma maman qui est une grande fan de vis et rivets vraiment ravie ! !;5;8 avril 2025;avr. 2025 • En famille;63;1;0.2023;Positif;0.0;0.0;Neutre;LABEL_1;0.9996737241744995
Nous sommes montés au deuxième étage de la Tour Eiffel.;Excellent guide. Notre guide était Fortune, il nous a raconté de nombreux faits intéressants dont nous nous souviendrons à jamais. Je recommande vraiment !;5;8 avril 2025;avr. 2025 • En famille;23;1;0.5719;Positif;1.0;1.0;Positif;LABEL_1;0.9996755123138428
Que Paris est beau vu d’en haut !;Une visite très agréable et riche de toutes les informations données par notre guide. Magnifique vue du second étage par un beau soleil, ce qui nous a fait oublier la longue file d’attente.;5;7 avril 2025;avr. 2025 • En famille;34;1;0.0;Neutre;0.0;0.0;Neutre;LABEL_1;0.9996401071548462
Tour Eiffel;Très belle visite guidée par Nihad. Excellente communication et bonne information avec une conversation agréable. Tout le monde dans le groupe était heureux;5;7 avril 2025;avr. 2025 • En couple;23;1;-0.128;Négatif;0.0;0.0;Neutre;LABEL_1;0.9996867179870605
Fortune ❤️Tour Eiffel magnifique;La fortune était superbe ! Superbe visite. C’est un guide incroyable. Je recommande vivement pour tous ceux qui cherchent un guide complet de l'histoire des monuments remarquables français que vous pourriez avoir une vue complète Birds Eye de la Tour Eiffel.;5;6 avril 2025;avr. 2025 • Entre amis;41;1;0.0;Neutre;0.0;0.0;Neutre;LABEL_1;0.999671220779419
Grand guide et expérience;La visite était fantastique. Martin, notre guide était très bien informé et accessible. Nous avons apprécié l'histoire de la tour et des conseils pour Paris. La tour elle-même était incroyable et nous avons vraiment apprécié la croisière fluviale ajoutée.;4;30 mars 2025;mars 2025 • En couple;40;1;0.0;Neutre;0.375;0.375;Positif;LABEL_1;0.9996740818023682
Magnifique première montée de la Tour Eiffel;Tout s’est très bien passé ! Notre guide Pierre a été très professionnel , gentil et sympathique ! Il sait nous partager ses connaissances sur la Tour Eiffel ! Nous avons vraiment apprécié cette expérience ! Merci à Pierre !;5;22 mars 2025;mars 2025 • En famille;35;1;-0.128;Négatif;0.0;0.0;Neutre;LABEL_1;0.9996811151504517
Super visite;J’ai adorée ma visite guidée de la Tour Eiffel avec Fetah.Je le recommande vivement 👍👍👍une expérience à ne pas manquer 👍👍👍👍👍👍👍👍;5;25 janvier 2025;janv. 2025 • En couple;22;1;0.0;Neutre;0.0;0.0;Neutre;LABEL_1;0.9996755123138428
Horrible;Bien qu’ayant payé 178 euros pour 2 adultes et deux enfants de 5 et 3 ans, nous avons attendu pendant plus de deux heures pour pouvoir accéder aux ascenseurs alors que le temp d’attente annoncé par le site puis par le guide était de 45 minutes.Voyant au bout de 2 heures que nous avions encore pour une heure d’attente nous avons renoncé et sommes partis révoltés par cette arnaque.;1;1 janvier 2025;déc. 2024 • En famille;73;1;0.0;Neutre;0.0;0.0;Neutre;LABEL_0;0.9798222184181213
Visite parfaite dirigée par Pranshu notre guide;Pranshu notre guide était très sympathique et détaillé pour faire monter ma famille sur la Tour Eiffel. Il est très bien informé et nous a fourni des informations très détaillées et l'histoire pendant la visite. 👍👍 fortement recommandé d'engager son service si vous souhaitez réserver cette visite.;5;17 décembre 2024;déc. 2024 • En famille;46;1;0.0;Neutre;0.0;0.0;Neutre;LABEL_1;0.9996364116668701
Super visite !;Mohamed a su partager ses connaissances avec enthousiasme et humour. Une fois arrivée au 2e étage nous avons pu observer les monuments emblématiques de Paris grâce aux repères du guide toujours accompagné d'anecdotes. Je recommande vivement Mohamed pour vos visites.;5;24 novembre 2024;;40;1;0.25;Positif;0.0;0.0;Neutre;LABEL_1;0.9996750354766846
Mauvaise organisation: Anticulturel, manque de respect du visiteur, mauvaiseimage à l étranger.;Très mauvaise organisation comme toujours. Une attente incompréhensible pour acheter un billet qui a ensuite la conséquence d affluence pour la visite. Par moment une seule caisse ouverte. Il suffirait de mettre des caisses automatiques CB comme au Louvre. La possibilité de réservation internet n est pas une excuse. C est anti-culturel et un manque de respect du visiteur, une mauvaise image à l étranger.;1;20 novembre 2024;oct. 2024 • En famille;66;1;0.2732;Positif;0.025;0.225;Neutre;LABEL_0;0.972192108631134
Une façon de découvrir la Tour Eiffel !;Il était facile de localiser notre guide avant de passer à travers la sécurité. Fortune a donné un aperçu clair de ce à quoi s'attendre alors que nous nous frayions un chemin (rapidement) à travers la ligne et que nous distrayions le groupe avec histoire et bonne humeur. Ses informations étaient si intéressantes que les voyageurs autour de nous ont écouté aussi!Une fois au deuxième niveau, il a donné une orientation de la ville et a indiqué les bâtiments et les zones clés.Nous nous sommes dirigés seuls vers le sommet. Bien que ce soit des nuages épais et que nous ne pouvions rien voir, c'était plutôt cool de monter dans l'ascenseur et de voir la lumière de la tour radio se refléter sur les nuages.L'expérience était un excellent équilibre entre le temps de groupe / information et le temps par nous-mêmes pour explorer et profiter de la Tour Eiffel.;5;18 novembre 2024;nov. 2024 • En couple;152;1;0.7717;Positif;0.675;0.825;Positif;LABEL_1;0.998993456363678
Tour Eiffel avec Mo A+;J'ai fait la tournée avec Mohsina. Très bien informé et a fait un excellent travail en racontant l'histoire de la Tour Eiffel et son histoire. Merci !;5;11 octobre 2024;oct. 2024 • En famille;26;1;0.5719;Positif;1.0;1.0;Positif;LABEL_1;0.9996788501739502
Visite de la tour Eiffel (ascenseur);Nous étions très bien accompagnés par Mohsina qui nous a donné plein d'informations intéressantes sur la construction et même les instructions d'entretien de la tour! Merci beaucoup!;5;11 octobre 2024;oct. 2024 • En solo;27;1;0.0;Neutre;0.0;0.0;Neutre;LABEL_1;0.9996767044067383
Mon meilleur visiste;Absolument un grand Guide avec une énorme connaissance de l'histoire de la Tour Eiffel et un style très drôle pour la raconter. Je recommande à 100 % ce mec !;5;9 octobre 2024;oct. 2024 • En famille;28;1;0.4588;Positif;0.5;1.0;Positif;LABEL_1;0.9996763467788696
Visite guidée - Une perte de temps;Si vous avez tendance à visiter la Tour Eiffel et souhaitez arriver au sommet, NE RÉSERVEZ PAS de visite guidée. Nous avons payé nos billets des semaines à l'avance, mais nous avons quand même dû faire la queue avec tout le monde pour passer la sécurité et encore pendant que le Guide touristique faisait la queue pour acheter nos billets, donc aucun avantage là-bas. En raison du nombre de visiteurs, le sommet de la tour est fréquemment fermé pendant une courte période, de sorte que nous n'avons pas été en mesure d'obtenir nos billets pour le sommet. La Guide nous a assuré que nous serions toujours en mesure d'atteindre le sommet, même si ses connaissances et son expérience savaient le contraire. C'était juste pour qu'on soit sûrs qu'elle soit payée. Si vous y allez par vous-mêmes, vous pouvez attendre que le haut se ré-ouvre, ce qui ne prend pas longtemps, obtenez vos billets et vous pouvez continuer votre visite. Les informations transmises par notre Guide étaient basiques et rien que vous ne pouviez obtenir de Wikipédia. Il s'agissait d'une visite unique de la Tour Eiffel et le rêve a été brisé. Ne te laisse pas faire.;1;8 octobre 2024;août 2024 • En couple;199;1;-0.128;Négatif;0.375;1.0;Positif;LABEL_0;0.6820448637008667
Belle visite de l'incroyable Tour Eiffel;Rachel a fait une très belle visite de la Tour Eiffel avec beaucoup de faits intéressants. Elle a partagé l'origine de la construction et des concepteurs que nous ne connaissions pas avant.Nous étions un assez grand groupe mais, elle nous a gardés ensemble et nous a guidés tout au long de la visite avant de nous libérer pour monter au sommet.;4;8 octobre 2024;;62;1;0.3612;Positif;0.225;0.7;Positif;LABEL_1;0.9995787739753723
Tour Eiffel;Attente beaucoup trop longue. Heureusement qu il ne pleuvait pas. Je ne vois pas l intérêt de réserver à  l avance si l entrée n est pas coupe file. En se présentant au guichet le jour même,  l attente est identique et l entrée moins chère. Le seul plus c est le guide qui était super ce jour là.;3;1 octobre 2024;sept. 2024 • Entre amis;59;1;0.5994;Positif;0.3333333333333333;0.6666666666666666;Positif;LABEL_1;0.5932823419570923
Eiffel Tour;Sankalp était le Guide touristique. Il était très instructif et serviable. Nous a dit à quoi nous attendre et comment descendre et continuer la visite.;5;30 septembre 2024;sept. 2024 • En couple;25;1;0.0;Neutre;0.0;0.0;Neutre;LABEL_1;0.9995844960212708
Musee Leonardo très interactif;Chouet petit musée... les inventions de Leonardo ont été reconstitués... très interactifs.. écrit en italien anglais et français.... une bonne heure de divertissement;4;25 octobre 2025;oct. 2025 • En couple;23;1;0.0;Neutre;0.0;0.0;Neutre;LABEL_1;0.9996484518051147
Bon musée;Ce fut une très bonne expérience pour une famille d'adolescents. Il était relativement bon marché en comparaison avec d'autres attractions et nous a permis d'apprendre pendant quelques heures pour éviter la pluie. Beaucoup d'éléments interactifs intéressants.Nous avons noté cela plus haut en raison du coût;5;23 octobre 2025;;46;1;0.4215;Positif;0.0;0.0;Neutre;LABEL_1;0.9995688796043396
Aperçu rapide des machines de DaVinci;Très interactif et mains - sur. J’ai senti que je n’avais pas assez d’informations dans chaque station. Je pense que cela plaît davantage aux familles avec des enfants plus jeunes.;3;10 octobre 2025;oct. 2025 • En couple;32;1;0.0;Neutre;0.0;0.0;Neutre;LABEL_1;0.9972673654556274
Nous avons apprécié la visite qui vaut bien le prix d'entrée. Cet homme était un génie. Bien avec une visite;Très bon vaut bien une visite bon rapport qualité-prix . fortement recommander surtout pour les ingénieurs . grande histoire du dôme et comment il a été fait;4;4 octobre 2025;oct. 2025 • Entre amis;26;1;0.0;Neutre;0.0;0.0;Neutre;LABEL_1;0.9996196031570435
Humble dans ma vie.;Tu ne peux pas croire tout ce qu'il a fait dans sa vie. Artiste, architecte, musicien et constructeur. L'expertise dans de multiples disciplines était humble.;5;28 septembre 2025;sept. 2025 • En couple;25;1;-0.128;Négatif;-0.2;0.4;Négatif;LABEL_1;0.9976577758789062
Géniale découverte;Expérience super on ne connaît jamais assez ces grands inventeurs mais Da Vinci est un maître dans plusieurs domaines une belle découverte;5;25 septembre 2025;sept. 2025 • En couple;22;1;0.5994;Positif;0.3333333333333333;0.6666666666666666;Positif;LABEL_1;0.999645471572876
Fun et interactif;Très amusant et interactif. Bon à visiter si vous voulez échapper à la pluie et en apprendre davantage sur le Vinci dans le processus. Nous sommes venus pour échapper à la pluie et avons fini par rester 2 heures à cause de la façon dont il était intéressant.;5;9 septembre 2025;;48;1;0.0;Neutre;0.0;0.0;Neutre;LABEL_1;0.9993460774421692
Un incontournable de Florence;Visite très intéressante et divertissante, c’est vraiment pour tous les âges et le côté interactif permet de réellement mettre en perspective le génie de Léonard de Vinci. À faire absolument !;5;21 août 2025;;31;1;0.0;Neutre;0.0;0.0;Neutre;LABEL_1;0.9996705055236816
Une belle découverte;Très intéressant et surtout de belles découvertes à titre personnelDa Vinci un génie à tous les niveauxLe musée est bien fait par type et inventions;5;20 août 2025;;25;1;0.0;Neutre;0.0;0.0;Neutre;LABEL_1;0.9996756315231323
Visite;C'était agréable et amusant et beaucoup à voir et à jouer avec - amis très enfants et bruyant cependant essayer de trouver un moment moins occupé pour aller.;4;17 août 2025;;27;1;0.0;Neutre;0.0;0.0;Neutre;LABEL_1;0.9995274543762207
Tres sympa;Tres sympa pour les enfants. Astuce, si vous etes une famille, achetez plutot vos billet sur place. Sur tripadvisor on  a paye 5€ plus cher 🤨;4;13 août 2025;août 2025 • En famille;25;1;0.0;Neutre;0.0;0.0;Neutre;LABEL_1;0.9987404942512512
Trop bien !!!;Parfait. Ricardo, notre guide, a très bien su nous transmettre l'histoire de Michel Ange.Visite très intéressante.Merci !!!;5;12 août 2025;août 2025 • En famille;18;1;0.0;Neutre;0.0;0.0;Neutre;LABEL_1;0.9996755123138428
Superbe;Superbe muséeIl est très intéressant et aussi très ludique.Pour tous les âgesLa description est également en francais;5;8 août 2025;août 2025 • En famille;18;1;0.0;Neutre;0.0;0.0;Neutre;LABEL_1;0.9996023774147034
Visite ludique pour les enfants;Nombreuses interactions proposées avec les inventions de Léonard de Vinci. Notre fille qui en est fan a adoré!Certaines salles deviennent néanmoins très bruyantes.A faire;4;1 août 2025;;26;1;0.3182;Positif;0.0;0.0;Neutre;LABEL_1;0.9988672733306885
Super amusant;Visite très intéressante et amusante surtout avec les adosA recommander même avec des plus jeunes car il y a des activités manuelles à réaliser soit même;5;24 juillet 2025;;26;1;0.0;Neutre;0.0;0.0;Neutre;LABEL_1;0.9996155500411987
Très bonne visite. Peu d’attente;Très joli musée où on peut jouer avec certaines attractions. Plutôt des activités pour jeunes enfants, mais chacun passe un bon moment;5;24 juillet 2025;;22;1;0.4215;Positif;0.0;0.0;Neutre;LABEL_1;0.9995806813240051
Découvertes très enrichissantes. Musée original. Possibilité de tester et de toucher les machines fabuleuses du fameux Léonard.;Découvertes très enrichissantes. Musée original. Possibilité de tester et de toucher les machines fabuleuses du fameux Léonard.;5;18 juillet 2025;juil. 2025;17;1;0.3182;Positif;0.375;0.75;Positif;LABEL_1;0.9996494054794312
Visite agréable;Ravi de visiter. Quelques écrans interagissants, principalement des écrans statiques.Pas bondé, bel envoûtement, bonne place.Belle boutique de filles, avec personel serviable.;4;16 juillet 2025;juin 2025 • En famille;23;1;0.0;Neutre;0.0;0.0;Neutre;LABEL_1;0.9996352195739746
Une étape amusante sur un voyage à Florence;Excellent ! Et j’ai eu des idées géniales pour des projets dans la cour arrière 🙂 le labo en bas était vraiment sympa car on peut utiliser les machines.;5;1 juillet 2025;;28;1;0.5719;Positif;1.0;1.0;Positif;LABEL_1;0.9996114373207092
Super;Bonjour,Très bonne expérience, très ludique et également très intéressant pour tout le monde, je recommande très chaudement;5;11 juin 2025;;18;1;-0.128;Négatif;0.0;0.0;Neutre;LABEL_1;0.9996742010116577
ARNAQUE;"Grande arnaque du site ; vous payez déjà sur le site puis un guide vous est imposé qui se fait payé en cash et qui parle en anglais. C'est superlucratif pour eux !Dégoût !";2;10 juin 2025;juin 2025 • En famille;32;1;0.0;Neutre;0.0;0.0;Neutre;LABEL_0;0.9633477926254272
Ludique et éducatif, juste parfait;Musée très sympa où l'on peut toucher et utiliser les inventions de Léonard! Il y a même des explications en Français, plutôt rare dans le coin. Très ludique et éducatif. Je recommande.;5;29 mai 2025;mai 2025 • En couple;32;1;0.0;Neutre;0.3;0.9;Positif;LABEL_1;0.999651312828064
Mais, WHY???!!!;Super, super intéressant,  mais vacances scolaires obligent,  très bruyant....A faire et à refaire...Les scientifique !!...;4;4 mai 2025;;16;1;0.8316;Positif;0.3333333333333333;0.6666666666666666;Positif;LABEL_1;0.9986081719398499
Instructif et ludique;Ce musee est à la fois Instructif et ludique. C'était un très bon moment.Je le recommande pour les petits comme pour les grands.;5;30 avril 2025;;24;1;0.0;Neutre;0.0;0.0;Neutre;LABEL_1;0.9996715784072876
Imaginative;L'endroit est incroyable surtout pour les enfants. C’est tellement imaginatif et créatif , montre la valeur de la façon dont Leonardo a changé la façon dont la science est aujourd’hui ! ! Expérience incroyable;5;26 avril 2025;avr. 2025 • En famille;33;1;0.0;Neutre;0.0;0.0;Neutre;LABEL_1;0.9996191263198853
Très bon musée;C'était bien, on a aime car intéressant, bonne explication des machines, des machined interactive et on apprends tout sur le génie de da vinci;4;17 avril 2025;avr. 2025 • En famille;24;1;-0.128;Négatif;0.0;0.0;Neutre;LABEL_1;0.9994969367980957
Les enfants aiment cet endroit;Super endroit pour les enfants, visité avec mon garçon de 8 ans et il a adoré. De nombreuses expositions interactives et certaines qui peuvent être tactiles aideront à leur créativité;5;12 avril 2025;avr. 2025 • En famille;30;1;0.5994;Positif;0.3333333333333333;0.6666666666666666;Positif;LABEL_1;0.9996054768562317
Très décevant.;Très décevant. Peu d'infos intéressantes. Quelques objets à manipuler et beaucoup à seulement regarder. Franchement, il y a tellement de beaux sites (musées, Palazzos, ...) à visiter, ne perdez pas votre temps ici.;2;9 avril 2025;mars 2025 • En solo;32;1;0.0;Neutre;0.0;0.0;Neutre;LABEL_1;0.996880292892456
Temps informatif !;Très intéressant ! Ce musée m’a donné envie d’en apprendre plus sur Léonard et ses nombreuses inventions. Ma chose préférée qu’il a créée que je ne savais pas qu’il avait créée était la version a du canon.;5;6 avril 2025;avr. 2025 • En couple;40;1;0.0;Neutre;0.0;0.0;Neutre;LABEL_1;0.9995855689048767
